Word,Synonyms
pieces,"piece, part, musical composition, opus, composition, piece of music, bit, firearm, small-arm, slice, objet d'art, art object, while, spell, patch, man, assemble, put together, set up, tack, tack together, nibble, pick"
left,"left, left wing, left hand, left field, leftfield, leave, go forth, go away, leave alone, leave behind, exit, go out, get out, allow for, allow, provide, result, lead, depart, pull up stakes, entrust, bequeath, will, impart, give, pass on, forget, leftover, left over, odd, remaining, unexpended, left-hand"
pie,"pie, Proto-Indo European, PIE"
hope,"hope, promise, Hope, Bob Hope, Leslie Townes Hope, trust, desire, go for"
lucky,"lucky, golden, favorable, favourable, prosperous"
injuries,"injury, hurt, harm, trauma, accidental injury, wound, combat injury"
heal,"mend, heal, bring around, cure"
crawled,"crawl, creep, fawn, cringe, cower, grovel"
delicious,"Delicious, delightful, delicious, delectable, luscious, pleasant-tasting, scrumptious, toothsome, yummy"
chicken,"chicken, poulet, volaille, Gallus gallus, wimp, crybaby, chickenhearted, lily-livered, white-livered, yellow, yellow-bellied"
guts,"backbone, grit, guts, moxie, sand, gumption, intestine, bowel, gut, catgut"
funny,"funny story, good story, funny remark, funny, amusing, comic, comical, laughable, mirthful, risible, curious, odd, peculiar, queer, rum, rummy, singular, fishy, shady, suspect, suspicious"
helpless,"helpless, incapacitated, lost"
praying,"pray, beg, implore"
hard,"difficult, hard, knockout, severe, arduous, backbreaking, grueling, gruelling, heavy, laborious, operose, punishing, toilsome, unvoiced, voiceless, surd, concentrated, intemperate, strong, tough, firmly, severely, heavily, intemperately"
dinner,"dinner, dinner party"
life,"life, living, animation, aliveness, lifetime, life-time, lifespan, liveliness, spirit, sprightliness, biography, life story, life history, life sentence"
guess,"guess, conjecture, supposition, surmise, surmisal, speculation, hypothesis, guesswork, guessing, shot, dead reckoning, think, opine, suppose, imagine, reckon, venture, pretend, hazard, estimate, gauge, approximate, judge, infer"
glanced,"glance, peek, glint"
poured,"pour, swarm, stream, teem, pullulate, decant, pour out, pelt, rain cats and dogs, rain buckets"
sweet,"Sweet, Henry Sweet, dessert, sweet, afters, confection, sweetness, sugariness, angelic, angelical, cherubic, seraphic, dulcet, honeyed, mellifluous, mellisonant, gratifying, odoriferous, odorous, perfumed, scented, sweet-scented, sweet-smelling, fresh, unfermented, sugared, sweetened, sweet-flavored, sweetly"
stuffing,"stuffing, dressing, stuff, thrust, shove, squeeze, lug, choke up, block, gorge, ingurgitate, overindulge, glut, englut, engorge, overgorge, overeat, gormandize, gormandise, gourmandize, binge, pig out, satiate, scarf out, farce"
line,"line, argumentation, logical argument, argument, line of reasoning, cable, transmission line, course, wrinkle, furrow, crease, crinkle, seam, pipeline, railway line, rail line, telephone line, phone line, telephone circuit, subscriber line, lineage, line of descent, descent, bloodline, blood line, blood, pedigree, ancestry, origin, parentage, stemma, stock, occupation, business, job, line of work, channel, communication channel, product line, line of products, line of merchandise, business line, line of business, agate line, credit line, line of credit, bank line, personal credit line, personal line of credit, tune, melody, air, strain, melodic line, melodic phrase, note, short letter, billet, dividing line, demarcation, contrast, production line, assembly line, run along, trace, draw, describe, delineate"
moist,"damp, dampish, moist"
pass,"base on balls, walk, pass, passing play, passing game, passing, mountain pass, notch, passport, laissez passer, strait, straits, head, bye, liberty chit, crack, fling, go, whirl, offer, toss, flip, qualifying, pas, go through, go across, travel by, pass by, surpass, go past, go by, legislate, elapse, lapse, slip by, glide by, slip away, slide by, go along, hand, reach, pass on, turn over, give, run, lead, extend, overtake, overhaul, happen, hap, go on, pass off, occur, fall out, come about, take place, clear, spend, guide, draw, communicate, pass along, put across, evanesce, fade, blow over, fleet, make it, exceed, transcend, overstep, top, sink, fall, return, devolve, make pass, authorize, authorise, die, decease, perish, exit, pass away, expire, kick the bucket, cash in one's chips, buy the farm, conk, give-up the ghost, drop dead, pop off, choke, croak, snuff it, excrete, egest, eliminate"
try,"attempt, effort, endeavor, endeavour, try, seek, essay, assay, test, prove, try out, examine, judge, adjudicate, sample, taste, hear, strain, stress, render, try on"
worried,"worry, care, vex, concern, interest, occupy, disquieted, distressed, disturbed, upset, worried, apprehensive"
kindly,"charitable, benevolent, kindly, sympathetic, good-hearted, openhearted, large-hearted"
expelled,"expel, throw out, kick out, oust, drum out, boot out, rout, rout out, exhaust, discharge, eject, release"
protect,protect
soldiers,soldier
settled,"settle, settle down, decide, resolve, adjudicate, square off, square up, determine, locate, reconcile, patch up, make up, conciliate, sink, go down, go under, root, take root, steady down, subside, ensconce, get back, finalize, finalise, nail down, fall, descend, settled, colonized, colonised"
kill,"killing, kill, putting to death, shoot down, defeat, vote down, vote out, stamp out, toss off, pop, bolt down, belt down, pour down, down, drink down, obliterate, wipe out"
club,"baseball club, ball club, club, nine, social club, society, guild, gild, lodge, order, clubhouse, golf club, golf-club, cabaret, nightclub, night club, nightspot, bludgeon"
calling,"career, calling, vocation, name, call, telephone, call up, phone, ring, shout, shout out, cry, yell, scream, holler, hollo, squall, send for, visit, call in, address, bid, call off, predict, foretell, prognosticate, forebode, anticipate, promise"
danger,"danger, risk, peril"
means,"means, agency, way, substance, mean, mean value, intend, entail, imply, signify, stand for, think, think of, have in mind"
stay,"stay, arrest, check, halt, hitch, stop, stoppage, remain, rest, stick, stick around, stay put, bide, abide, stay on, continue, detain, delay, persist, last out, ride out, outride, quell, appease"
youngest,"young, immature, new, youthful, vernal, unseasoned, untested, untried"
let,"Lashkar-e-Taiba, Lashkar-e-Toiba, Lashkar-e-Tayyiba, LET, Army of the Pure, Army of the Righteous, let, net ball, allow, permit, countenance, get, have, lease, rent"
outspoken,"outspoken, vocal, blunt, candid, forthright, frank, free-spoken, plainspoken, point-blank, straight-from-the-shoulder"
hear,"hear, learn, get word, get wind, pick up, find out, get a line, discover, see, try, listen, take heed"
oatmeal,"oatmeal, burgoo, rolled oats"
spoonfuls,"spoon, spoonful"
nodded,nod
certain,"certain, sure, sealed"
realized,"recognize, recognise, realize, realise, agnize, agnise, understand, see, actualize, actualise, substantiate, gain, take in, clear, make, earn, pull in, bring in, accomplished, completed, realized, realised"
scowled,scowl
want,"privation, want, deprivation, neediness, lack, deficiency, need, wish, wishing, desire, require"
wo,
walk,"walk, walking, base on balls, pass, manner of walking, walkway, paseo, walk of life, take the air"
clever,"cagey, cagy, canny, clever, apt, cunning, ingenious"
group,"group, grouping, radical, chemical group, mathematical group, aggroup"
women,"woman, adult female, charwoman, char, cleaning woman, cleaning lady, womanhood, fair sex"
votes,"vote, ballot, voting, balloting, right to vote, suffrage, voter turnout"
page,"page, Page, Sir Frederick Handley Page, Thomas Nelson Page, pageboy, varlet, foliate, paginate"
article,"article, clause"
door,"door, doorway, room access, threshold"
members,"member, fellow member, extremity, appendage, penis, phallus"
snowed,"snow, bamboozle, hoodwink, pull the wool over someone's eyes, lead by the nose, play false"
associated,"associate, tie in, relate, link, colligate, link up, connect, consort, affiliate, assort, consociate"
actor,"actor, histrion, player, thespian, role player, doer, worker"
graduation,"graduation, commencement, commencement exercise, commencement ceremony, graduation exercise, gradation"
tickets,"ticket, tag, slate, just the ticket, fine"
ready,"ready, cook, fix, make, prepare, set up, gear up, set, quick"
opinions,"opinion, sentiment, persuasion, view, thought, public opinion, popular opinion, vox populi, legal opinion, judgment, judgement, ruling, impression, feeling, belief, notion"
police,"police, police force, constabulary, law, patrol"
reason,"reason, ground, understanding, intellect, rationality, reasonableness, cause, grounds, reason out, conclude, argue"
husband,"husband, hubby, married man, conserve, economize, economise"
member,"member, fellow member, extremity, appendage, penis, phallus"
oppose,"oppose, fight, fight back, fight down, defend, counterbalance, pit, match, play off, react, controvert, contradict"
formed,"form, organize, organise, constitute, make, take form, take shape, spring, shape, work, mold, mould, forge, imprint, formed"
clutched,"seize, prehend, clutch, cling to, hold close, hold tight, get hold of"
able,"able, capable, able-bodied"
wheel,"wheel, steering wheel, roulette wheel, rack, bicycle, bike, cycle, wheel around, roll, pedal"
world,"universe, existence, creation, world, cosmos, macrocosm, domain, reality, Earth, earth, globe, populace, public, worldly concern, earthly concern, human race, humanity, humankind, human beings, humans, mankind, man, global, planetary, worldwide, world-wide"
filled,"fill, fill up, make full, occupy, take, meet, satisfy, fulfill, fulfil, satiate, sate, replete, filled"
hate,"hate, hatred, detest"
woke,"wake, wake up, awake, arouse, awaken, come alive, waken, inflame, stir up, ignite, heat, fire up, rouse"
speak,"talk, speak, utter, mouth, verbalize, verbalise, address"
signed,"sign, subscribe, ratify, contract, sign on, sign up, signal, signalize, signalise, bless, signed, gestural, sign-language"
steering,"guidance, steering, direction, steerage, steer, maneuver, manoeuver, manoeuvre, direct, point, head, guide, channelize, channelise"
invited,"invite, ask for, ask over, ask round, tempt, bid, pay for, ask in, call for, receive, take in"
upset,"disturbance, perturbation, upset, derangement, overthrow, disorder, swage, overturn, turnover, discompose, untune, disconcert, discomfit, disturb, trouble, tip over, turn over, knock over, bowl over, tump over, disquieted, distressed, disturbed, worried, broken, confused, disordered, overturned, upturned"
remember,"remember, retrieve, recall, call back, call up, recollect, think, think of, think back, commend, commemorate"
cry,"cry, outcry, call, yell, shout, vociferation, war cry, rallying cry, battle cry, watchword, shout out, scream, holler, hollo, squall, weep, exclaim, cry out, call out, blazon out"
minister,"curate, minister of religion, minister, parson, pastor, rector, government minister, diplomatic minister"
older,"aged, elderly, older, senior, elder, sr., old, erstwhile, former, onetime, one-time, quondam, sometime, honest-to-god, honest-to-goodness, sure-enough, Old, previous"
avowed,"affirm, verify, assert, avow, aver, swan, swear, avouch, avowed, professed"
purpose,"purpose, intent, intention, aim, design, function, role, use, determination, purport, propose, resolve"
support,"support, reinforcement, reenforcement, documentation, keep, livelihood, living, bread and butter, sustenance, supporting, accompaniment, musical accompaniment, backup, financial support, funding, backing, financial backing, back up, back, endorse, indorse, plump for, plunk for, hold, sustain, hold up, confirm, corroborate, substantiate, affirm, subscribe, underpin, bear out, defend, fend for, patronize, patronise, patronage, keep going, digest, endure, stick out, stomach, bear, stand, tolerate, brook, abide, suffer, put up"
segregation,"segregation, separatism, sequestration"
pictures,"picture, image, icon, ikon, painting, mental picture, impression, scene, pictorial matter, movie, film, moving picture, moving-picture show, motion picture, motion-picture show, picture show, pic, flick, video, word picture, word-painting, delineation, depiction, characterization, characterisation, photograph, photo, exposure, visualize, visualise, envision, project, fancy, see, figure, depict, render, show"
case,"case, instance, example, event, lawsuit, suit, cause, causa, subject, guinea pig, caseful, grammatical case, character, eccentric, type, font, fount, typeface, face, sheath, shell, casing, compositor's case, typesetter's case, pillowcase, slip, pillow slip, display case, showcase, vitrine, encase, incase"
knuckles,"brass knucks, knucks, brass knuckles, knuckles, knuckle duster, knuckle, knuckle joint, metacarpophalangeal joint"
ears,"ear, auricle, pinna, spike, capitulum"
trying,"try, seek, attempt, essay, assay, test, prove, try out, examine, judge, adjudicate, sample, taste, hear, strain, stress, render, try on, trying, nerve-racking, nerve-wracking, stressful"
order,"order, order of magnitude, ordering, ordination, orderliness, decree, edict, fiat, rescript, purchase order, club, social club, society, guild, gild, lodge, rules of order, parliamentary law, parliamentary procedure, Holy Order, Order, monastic order, tell, enjoin, say, prescribe, dictate, regulate, regularize, regularise, govern, ordain, consecrate, ordinate, arrange, set up, put, rate, rank, range, grade, place"
news,"news, intelligence, tidings, word, news program, news show, newsworthiness"
fat,"fat, adipose tissue, fatty tissue, fatness, blubber, avoirdupois, fatten, flesh out, fill out, plump, plump out, fatten out, fatten up, fatty, juicy, fertile, productive, rich"
blond,"blond, blonde, light-haired"
caterpillars,"caterpillar, Caterpillar, cat"
wriggling,"writhe, wrestle, wriggle, worm, squirm, twist, wiggly, wriggling, wriggly, writhing"
spoke,"spoke, wheel spoke, radius, rundle, rung, talk, speak, utter, mouth, verbalize, verbalise, address"
missed,"miss, lose, neglect, pretermit, omit, drop, leave out, overlook, overleap, lack, escape, lost, missed"
parents,"parent, rear, raise, bring up, nurture"
eyebrows,"eyebrow, brow, supercilium"
crooked,"crook, curve, crooked, corrupt, asymmetrical, hunched, round-backed, round-shouldered, stooped, stooping"
swing,"swing, swinging, vacillation, swing music, jive, lilt, golf stroke, golf shot, baseball swing, cut, sway, swing over, sweep, swing out, dangle, drop, get around"
lock,"lock, curl, ringlet, whorl, lock chamber, ignition lock, engage, mesh, operate, interlock, interlace, lock in, lock away, put away, shut up, shut away, lock up"
tower,"tower, column, pillar, tugboat, tug, towboat, loom, predominate, hulk"
classroom,"classroom, schoolroom"
appears,"look, appear, seem, come out, come along"
ideal,"ideal, paragon, nonpareil, saint, apotheosis, nonesuch, nonsuch, idealistic"
explained,"explain, explicate, excuse"
starting,"start, starting, get down, begin, get, start out, set about, set out, commence, lead off, depart, part, set forth, set off, take off, originate, initiate, start up, embark on, startle, jump, go, get going, take up, protrude, pop, pop out, bulge, bulge out, bug out, come out"
hissed,"hiss, siss, sizz, sibilate, whoosh, boo"
car,"car, auto, automobile, machine, motorcar, railcar, railway car, railroad car, gondola, elevator car, cable car"
water,"water, H2O, body of water, water system, water supply, urine, piss, pee, piddle, weewee, irrigate"
splashed,"sprinkle, splash, splosh, squelch, squish, slosh, slop, spatter, splatter, plash, swash, slush, splashed, dabbled, spattered, splattered"
sink,"sink, sinkhole, swallow hole, cesspool, cesspit, sump, drop, drop down, pass, lapse, settle, go down, go under, subside, dip, slump, fall off, slide down, bury"
crying,"crying, weeping, tears, cry, outcry, call, yell, shout, vociferation, war cry, rallying cry, battle cry, watchword, shout out, scream, holler, hollo, squall, weep, exclaim, cry out, call out, blazon out, clamant, exigent, insistent, instant, egregious, flagrant, glaring, gross, rank"
stalls,"stable, stalls, horse barn, stall, booth, cubicle, kiosk, stand, sales booth, carrel, carrell, stalling, procrastinate, drag one's feet, drag one's heels, shillyshally, dilly-dally, dillydally, conk"
sitting,"sitting, posing, seance, session, sit, sit down, sit around, model, pose, posture, ride, baby-sit, seat, seated"
remain,"stay, remain, rest, stay on, continue, persist"
interrupted,"interrupt, disrupt, break up, cut off, disturb, break, interrupted, fitful, off-and-on"
live,"populate, dwell, live, inhabit, survive, last, live on, go, endure, hold up, hold out, exist, subsist, be, know, experience, unrecorded, alive, bouncy, lively, resilient, springy, hot"
confusion,"confusion, mental confusion, confusedness, muddiness, disarray, discombobulation, mix-up"
mother’d,
indefinitely,indefinitely
private,"private, buck private, common soldier, individual, secret"
insisted,"insist, take a firm stand, importune, assert"
stared,"gaze, stare, star, asterisk"
leaving,"departure, going, going away, leaving, leave, go forth, go away, leave alone, leave behind, exit, go out, get out, allow for, allow, provide, result, lead, depart, pull up stakes, entrust, bequeath, will, impart, give, pass on, forget"
ruining,"laying waste, ruin, ruining, ruination, wrecking, destroy, bankrupt, break, smash, deflower"
thank,"thank, give thanks"
papers,"document, written document, papers, paper, composition, report, theme, newspaper, newspaper publisher, wallpaper"
desk,desk
approach,"approach, attack, plan of attack, approaching, coming, access, approach path, glide path, glide slope, overture, advance, feeler, approach shot, near, come on, go up, draw near, draw close, come near, border on, set about, go about"
opposite,"antonym, opposite word, opposite, reverse, contrary, opposition, opponent, inverse, paired, diametric, diametrical, polar, face-to-face"
taken,"take, occupy, use up, lead, direct, conduct, guide, get hold of, assume, acquire, adopt, take on, read, bring, convey, choose, select, pick out, accept, have, fill, consider, deal, look at, necessitate, ask, postulate, need, require, involve, call for, demand, film, shoot, remove, take away, withdraw, consume, ingest, take in, submit, strike, take up, admit, learn, study, claim, exact, make, aim, train, take aim, carry, pack, lease, rent, hire, charter, engage, subscribe, subscribe to, contain, hold, drive, contract, get, interpreted, taken"
grading,"scaling, grading, leveling, marking, scoring, rate, rank, range, order, grade, place, score, mark"
choice,"choice, pick, selection, option, alternative, prime, prize, quality, select"
snapped,"snap, snarl, tear, rupture, bust, crack, click, snatch, snatch up, flick, break down, lose it, photograph, shoot"
concern,"concern, care, fear, worry, headache, vexation, business, business concern, business organization, business organisation, refer, pertain, relate, come to, bear on, touch, touch on, have-to doe with, interest, occupy"
porch,porch
stand,"base, pedestal, stand, rack, standstill, tie-up, point of view, viewpoint, standpoint, stall, sales booth, bandstand, outdoor stage, stand up, remain firm, digest, endure, stick out, stomach, bear, tolerate, support, brook, abide, suffer, put up, place upright, resist, fend"
happened,"happen, hap, go on, pass off, occur, pass, fall out, come about, take place, befall, bechance, materialize, materialise, find, chance, bump, encounter"
found,"found, establish, set up, launch, plant, constitute, institute, base, ground, find, happen, chance, bump, encounter, detect, observe, discover, notice, regain, determine, find out, ascertain, feel, witness, see, line up, get hold, come up, rule, receive, get, obtain, incur, recover, retrieve, find oneself"
cafeteria,cafeteria
occasionally,"occasionally, on occasion, once in a while, now and then, now and again, at times, from time to time"
granny,"grandma, grandmother, granny, grannie, gran, nan, nanna, granny knot"
plate,"home plate, home base, home, plate, plateful, crustal plate, photographic plate, collection plate, scale, shell, denture, dental plate"
pancake,"pancake, battercake, flannel cake, flannel-cake, flapcake, flapjack, griddlecake, hotcake, hot cake"
eaten,"eat, feed, eat on, consume, eat up, use up, deplete, exhaust, run through, wipe out, corrode, rust"
wallowing,"wallow, welter, billow, rejoice, triumph"
kissed,"snog, kiss, buss, osculate"
touched,"touch, stir, refer, pertain, relate, concern, come to, bear on, touch on, have-to doe with, adjoin, meet, contact, affect, impact, bear upon, reach, extend to, equal, rival, match, disturb, allude, advert, partake, tint, tinct, tinge, touched, moved, affected, stirred, fey"
tears,"crying, weeping, tears, tear, teardrop, rip, rent, snag, split, bust, binge, bout, rupture, snap, shoot, shoot down, charge, buck, pluck, pull, deplume, deplumate, displume"
burst,"explosion, burst, fusillade, salvo, volley, fit, outburst, flare-up, split, break open, break, erupt, explode, abound, bristle, collapse, bust"
dearest,"beloved, dear, dearest, honey, love, darling, good, near, devout, earnest, heartfelt, costly, high-priced, pricey, pricy"
relent,"yield, relent, soften"
curled,"curl, curve, kink, curl up, draw in, coil, loop, wave, curled, curling"
trunk,"trunk, tree trunk, bole, torso, body, luggage compartment, automobile trunk, proboscis"
suitcase,"bag, traveling bag, travelling bag, grip, suitcase"
cheek,"cheek, impudence, impertinence, buttock, boldness, nerve, brass, face"
tonight,"tonight, this evening, this night"
youth,"young person, youth, younker, spring chicken, young, early days, youthfulness, juvenility"
station,"station, place, post, send"
wart,"wart, verruca"
maple,maple
middle,"center, centre, middle, heart, eye, midriff, midsection, in-between, mediate, halfway, midway"
rapped,"rap, knap, tap, knock, pink"
stayed,"stay, remain, rest, stick, stick around, stay put, bide, abide, stay on, continue, detain, delay, persist, last out, ride out, outride, quell, appease"
owe,owe
lot,"batch, deal, flock, good deal, great deal, hatful, heap, lot, mass, mess, mickle, mint, mountain, muckle, passel, peck, pile, plenty, pot, quite a little, raft, sight, slew, spate, stack, tidy sum, wad, set, circle, band, fortune, destiny, fate, luck, circumstances, portion, draw, bunch, caboodle, Lot, distribute, administer, mete out, parcel out, dispense, shell out, deal out, dish out, allot, dole out"
father,"father, male parent, begetter, forefather, sire, Father, Padre, Church Father, Father of the Church, Father-God, Fatherhood, founder, beginner, founding father, don, beget, get, engender, mother, generate, bring forth"
rode,"ride, sit, tease, razz, rag, cod, tantalize, tantalise, bait, taunt, twit, rally, drive, depend on, devolve on, depend upon, turn on, hinge on, hinge upon, mount"
hurt,"injury, hurt, harm, trauma, distress, suffering, detriment, damage, scathe, ache, smart, pain, anguish, injure, wound, bruise, offend, spite, suffer, wounded, weakened"
personally,"personally, in person"
saved,"salvage, salve, relieve, save, preserve, carry through, pull through, bring through, lay aside, save up, make unnecessary, deliver, redeem, spare, economize, economise, keep open, hold open, keep, write, saved, protected"
soviet,"soviet, Soviet"
invasion,"invasion, encroachment, intrusion"
hero,"hero, champion, fighter, paladin, Hero, Heron, Hero of Alexandria, bomber, grinder, hero sandwich, hoagie, hoagy, Cuban sandwich, Italian sandwich, poor boy, sub, submarine, submarine sandwich, torpedo, wedge, zep"
acting,"acting, playing, playacting, performing, act, move, behave, do, play, represent, act as, work, dissemble, pretend, roleplay, playact"
usual,"usual, common"
spot,"topographic point, place, spot, point, smudge, blot, daub, smear, smirch, slur, speckle, dapple, patch, fleck, maculation, position, post, berth, office, billet, situation, touch, bit, pip, spotlight, stain, descry, espy, spy, recognize, recognise, distinguish, discern, pick out, make out, tell apart, blemish, blob"
retelling,"recite, retell, fictionalize, fictionalise, repeat, reiterate, ingeminate, iterate, restate"
gossip,"chitchat, chit-chat, chit chat, small talk, gab, gabfest, gossip, tittle-tattle, chin wag, chin-wag, chin wagging, chin-wagging, causerie, comment, scuttlebutt, gossiper, gossipmonger, rumormonger, rumourmonger, newsmonger, dish the dirt, chew the fat, shoot the breeze, chat, confabulate, confab, chatter, chaffer, natter, jaw, claver, visit"
bike,"motorcycle, bike, bicycle, wheel, cycle, pedal"
pews,"pew, church bench"
softened,"soften, dampen, damp, weaken, break, yield, relent, cushion, buffer, mince, moderate, softened, dull, muffled, muted"
clear,"clear, open, unclutter, clear up, light up, brighten, authorize, authorise, pass, top, shed light on, crystallize, crystallise, crystalize, crystalise, straighten out, sort out, enlighten, illuminate, elucidate, net, sack, sack up, gain, take in, make, earn, realize, realise, pull in, bring in, acquit, assoil, discharge, exonerate, exculpate, solve, clean, light, unclouded, unmortgaged, clean-cut, clear-cut, well-defined, decipherable, readable, absolved, cleared, exculpated, exonerated, vindicated, percipient, all the way, clearly"
tone,"tone, tone of voice, timbre, timber, quality, spirit, feel, feeling, flavor, flavour, look, smell, shade, tint, tincture, note, musical note, pure tone, tonicity, tonus, whole tone, step, whole step, chant, intone, inflect, modulate, tone up, strengthen"
politely,"politely, courteously"
syrup,"syrup, sirup"
snatched,"snatch, snatch up, snap, kidnap, nobble, abduct"
