Word,Synonyms
flip,"somersault, somerset, summersault, summerset, somersaulting, flip, toss, pass, throw, switch, flick, thumb, riffle, leaf, riff, twitch, sky, pitch, flip over, turn over, flip out, interchange, tack, alternate, flip-flop, impudent, insolent, snotty-nosed"
doubtful,"doubtful, dubious, dubitable, in question, tentative"
stick,"stick, control stick, joystick, pin, peg, joint, marijuana cigarette, reefer, spliff, lodge, wedge, deposit, stay, stick around, stay put, adhere, hold fast, bond, bind, stick to, stand by, stick by, cling, cleave, cohere, sting, perplex, vex, get, puzzle, mystify, baffle, beat, pose, bewilder, flummox, stupefy, nonplus, gravel, amaze, dumbfound"
breathe,"breathe, take a breath, respire, suspire, rest, catch one's breath, take a breather, emit, pass off"
bent,"bent, set, bent grass, bent-grass, knack, hang, bend, flex, deform, twist, turn, crouch, stoop, bow, deflect, turn away, bent on, dead set, out to, bended, crumpled, dented"
scooped,"scoop, scoop out, lift out, scoop up, take up, outdo, outflank, trump, best"
jerk,"jerk, dork, jerking, jolt, saccade, jerky, jerked meat, tug, yank, twitch, buck, hitch, flick"
hills,"hill, mound, Hill, J. J. Hill, James Jerome Hill, Benny Hill, Alfred Hawthorne, pitcher's mound"
rolling,"peal, pealing, roll, rolling, wheeling, turn over, wheel, undulate, roll out, wind, wrap, twine, hustle, pluck, flap, wave, wander, swan, stray, tramp, roam, cast, ramble, rove, range, drift, vagabond, revolve, seethe, roll up, rolled, trilled"
direction,"direction, way, guidance, counsel, counseling, counselling, management, instruction, steering, commission, charge, focus, focusing, focussing, focal point, centering"
peeking,"glance, peek, glint"
pincher,
paintbrush,paintbrush
jonquils,"jonquil, Narcissus jonquilla"
crocuses,crocus
wild,"wild, natural state, state of nature, wilderness, untamed, violent, baseless, groundless, idle, unfounded, unwarranted, raving mad, hazardous, risky, fantastic, godforsaken, waste, crazy, dotty, gaga, barbarian, barbaric, savage, uncivilized, uncivilised, angry, furious, raging, tempestuous, rampantly"
field,"field, battlefield, battleground, field of battle, field of honor, discipline, subject, subject area, subject field, field of study, study, bailiwick, field of force, force field, field of operation, line of business, sphere, domain, area, orbit, arena, playing field, athletic field, playing area, plain, champaign, field of operations, theater, theater of operations, theatre, theatre of operations, field of view, airfield, landing field, flying field"
warm,"warm, warm up, affectionate, fond, lovesome, tender, strong, quick, ardent, warmly"
skating,"skating, skate"
stones,"rock, stone, gem, gemstone, pit, endocarp, Stone, Harlan Stone, Harlan F. Stone, Harlan Fisk Stone, Oliver Stone, Lucy Stone, I. F. Stone, Isidor Feinstein Stone, Harlan Fiske Stone, Edward Durell Stone, lapidate"
crevice,"crevice, cranny, crack, fissure, chap, cleft, scissure"
complexion,"complexion, skin color, skin colour"
learn,"learn, larn, acquire, hear, get word, get wind, pick up, find out, get a line, discover, see, memorize, memorise, con, study, read, take, teach, instruct, determine, check, ascertain, watch"
sputtered,"sputter, clamber, scramble, shin, shinny, skin, struggle, splutter, spit out"
raining,"rain, rain down, raining"
pull,"pull, pulling, clout, wrench, twist, puff, drag, draw, force, attract, pull in, draw in, perpetrate, commit, pull out, get out, take out, overstretch, rend, rip, rive, pluck, tear, deplume, deplumate, displume, extract, pull up, draw out, root for"
store,"shop, store, stock, fund, memory, computer memory, storage, computer storage, memory board, storehouse, depot, entrepot, hive away, lay in, put in, salt away, stack away, stash away"
sniffed,"sniff, whiff, sniffle"
skate,skate
lime,"calcium hydroxide, lime, slaked lime, hydrated lime, calcium hydrate, caustic lime, lime hydrate, calcium oxide, quicklime, calx, calcined lime, fluxing lime, unslaked lime, burnt lime, birdlime, lime tree, Citrus aurantifolia, linden, linden tree, basswood"
growing,"growth, growing, maturation, development, ontogeny, ontogenesis, turn, grow, mature, maturate, originate, arise, rise, develop, uprise, spring up, raise, farm, produce, get, acquire"
waltz,"walk-in, waltz, valse, waltz around"
switched,"switch over, switch, exchange, trade, swap, swop, shift, change, change over, throw, flip, interchange, tack, alternate, flip-flop"
organist,organist
lights,"light, visible light, visible radiation, light source, luminosity, brightness, brightness level, luminance, luminousness, illumination, lightness, lighting, sparkle, twinkle, spark, Inner Light, Light, Light Within, Christ Within, lighter, igniter, ignitor, illume, illumine, light up, illuminate, fire up, alight, perch, ignite, fall, unhorse, dismount, get off, get down"
leather,leather
skates,skate
smarter,"smart, chic, voguish, bright, fresh, impertinent, impudent, overbold, saucy, sassy, wise"
dimmed,"dim, dip, blind, blur, slur, dimmed"
gripped,"grip, grapple, fascinate, transfix, spellbind"
waltzed,"waltz, waltz around"
bouquet,"bouquet, corsage, posy, nosegay, fragrance, fragrancy, redolence, sweetness"
skated,skate
rose,"rose, rosebush, blush wine, pink wine, rose wine, rosiness, rise, lift, arise, move up, go up, come up, uprise, climb, get up, stand up, rear, surface, rise up, originate, develop, spring up, grow, ascend, wax, mount, heighten, turn out, jump, climb up, rebel, prove, resurrect, roseate, rosaceous"
organ,"organ, electric organ, electronic organ, Hammond organ, pipe organ, harmonium, reed organ"
sang,"American ginseng, sang, Panax quinquefolius, sing, whistle, spill the beans, let the cat out of the bag, talk, tattle, blab, peach, babble, babble out, blab out"
candles,"candle, taper, wax light, candela, cd, standard candle"
victory,"victory, triumph"
lap,"lap, lap covering, overlap, circle, circuit, lick, swish, swosh, swoosh, lap up, lave, wash"
runner,"smuggler, runner, contrabandist, moon curser, moon-curser, base runner, stolon, offset, ball carrier, blue runner, Caranx crysos"
thrown,"throw, shed, cast, cast off, shake off, throw off, throw away, drop, thrust, give, flip, switch, project, contrive, bewilder, bemuse, discombobulate, hurl, hold, have, make, confuse, fox, befuddle, fuddle, bedevil, confound, thrown, thrown and twisted"
calm,"composure, calm, calmness, equanimity, calm air, calm down, quiet, tranquilize, tranquillize, tranquillise, quieten, lull, still, steady, becalm, cool off, chill out, simmer down, settle down, cool it, sedate, unagitated, serene, tranquil"
buy,"bargain, buy, steal, purchase, bribe, corrupt, grease one's palms"
dress,"dress, frock, attire, garb, apparel, wearing apparel, clothes, get dressed, clothe, enclothe, raiment, tog, garment, habilitate, fit out, dress up, preen, primp, plume, dress out, line up, trim, garnish, decorate, snip, clip, crop, lop, prune, cut back, groom, curry, arrange, set, do, coif, coiffe, coiffure, full-dress"
diagonals,"diagonal, bias, solidus, slash, virgule, stroke, separatrix"
frothy,"bubbling, bubbly, foaming, foamy, frothy, effervescing, spumy, effervescent, scintillating, sparkly"
cotton,"cotton, cotton fiber, cotton wool, cotton plant"
pair,"pair, brace, couple, twosome, twain, span, yoke, couplet, distich, duo, duet, dyad, duad, pair off, partner off, match, mate, twin, geminate, copulate"
rent,"rent, rip, snag, split, tear, economic rent, lease, let, hire, charter, engage, take, rend, rive, pull"
dated,"date, date stamp, go steady, go out, see, dated"
adding,"add, append, supply, lend, impart, bestow, contribute, bring, add together, total, tot, tot up, sum, sum up, summate, tote up, tally, add up"
maximum,"maximum, upper limit, utmost, uttermost, level best, maximal"
presents,"present, nowadays, present tense, show, demo, exhibit, demonstrate, represent, lay out, stage, submit, pose, award, give, gift, deliver, introduce, acquaint, portray, confront, face, salute"
lecture,"lecture, public lecture, talk, speech, talking to, lecturing, call on the carpet, take to task, rebuke, rag, trounce, reproof, reprimand, jaw, dress down, call down, scold, chide, berate, bawl out, remonstrate, chew out, chew up, have words, lambaste, lambast"
comes,"semen, seed, seminal fluid, ejaculate, cum, come, come up, arrive, get, follow, issue forth, hail, fall, total, number, add up, amount, come in, occur, derive, descend, do, fare, make out, get along"
brushes,"brush, brushwood, coppice, copse, thicket, light touch, clash, encounter, skirmish, brushing, sweep"
protractor,protractor
pencils,pencil
graph,"graph, graphical record, chart"
package,"package, bundle, packet, parcel, software, software program, computer software, software system, software package, box"
worn,"wear, have on, bear, wear off, wear out, wear down, wear thin, hold out, endure, break, bust, fall apart, tire, wear upon, tire out, weary, jade, outwear, fag out, fag, fatigue, put on, get into, don, assume, worn, careworn, drawn, haggard, raddled"
preferred,"prefer, choose, opt, favor, favour, preferable, preferred, favored, favorite, favourite, best-loved, pet, preferent"
natural,"natural, cancel, instinctive, raw, rude, born, innate, lifelike"
pleaded,plead
troubles,"trouble, problem, fuss, bother, hassle, difficulty, worry, disturb, upset, put out, inconvenience, disoblige, discommode, incommode, perturb, unhinge, disquiet, cark, distract, disorder, trouble oneself, inconvenience oneself, ail, pain"
womanly,"womanly, feminine"
problem,"problem, job, trouble"
shifting,"shift, shifting, switch, change over, dislodge, reposition, transfer, stir, budge, agitate, careen, wobble, tilt, lurch, pitch, change, shifty, unfirm"
polka,polka
playing,"playing, acting, playacting, performing, play, act, represent, spiel, act as, recreate, toy, run, fiddle, diddle, dally, trifle, flirt, roleplay, playact, bring, work, wreak, make for, bet, wager, meet, encounter, take on"
piano,"piano, pianoforte, forte-piano, pianissimo, soft, softly"
drifted,"float, drift, be adrift, blow, stray, err, roll, wander, swan, tramp, roam, cast, ramble, rove, range, vagabond, freewheel"
overheard,"catch, take in, overhear"
hates,"hate, hatred, detest, hat"
snack,"bite, collation, snack, nosh"
disappointed,"disappoint, let down, defeated, disappointed, discomfited, foiled, frustrated, thwarted"
creepy,"creepy, creepy-crawly"
scholar,"scholar, scholarly person, bookman, student, learner, assimilator"
drove,"drove, horde, swarm, drove chisel, drive, motor, force, ram, repel, repulse, force back, push back, beat back, tug, labor, labour, push, get, aim, ride, take"
setting,"setting, scene, background, scope, mise en scene, stage setting, context, circumstance, place setting, mount, put, set, place, pose, position, lay, determine, specify, define, fix, limit, mark, prepare, set up, ready, gear up, localize, localise, go down, go under, arrange, plant, jell, congeal, typeset, countersink, sic, rig, lay out, adjust, correct, fructify, dress, do, coif, coiffe, coiffure"
couples,"couple, twosome, duo, duet, mates, match, pair, twain, brace, span, yoke, couplet, distich, dyad, duad, mate, twin, couple on, couple up, pair off, partner off, copulate"
waltzes,"walk-in, waltz, valse, waltz around"
knows,"know, cognize, cognise, experience, live, acknowledge, recognize, recognise, sleep together, roll in the hay, love, make out, make love, sleep with, get laid, have sex, do it, be intimate, have intercourse, have it away, have it off, screw, fuck, jazz, eff, hump, lie with, bed, have a go at it, bang, get it on, bonk"
ninety,"ninety, 90, XC, xc"
percent,"percentage, percent, per centum, pct"
exchanged,"exchange, change, interchange, commute, convert, switch over, switch, substitute, replace, exchanged"
thread,"thread, yarn, ribbon, train of thought, screw thread, weave, wind, meander, wander, string, draw"
hiccuped,"hiccup, hiccough"
laugh,"laugh, laughter, joke, gag, jest, jape, express joy, express mirth"
aside,"aside, digression, excursus, divagation, parenthesis, away, apart, by"
professors,"professor, prof"
lean,"tilt, list, inclination, lean, leaning, tip, slant, angle, tend, be given, incline, run, thin, skimpy"
balancing,"reconciliation, balancing, balance, equilibrate, equilibrize, equilibrise, poise"
toddler,"toddler, yearling, tot, bambino"
type,"type, character, eccentric, case, typewrite, typecast"
sponge,"sponge, quick study, leech, parasite, sponger, poriferan, parazoan, mooch, bum, cadge, grub"
stamp,"cast, mold, mould, stamp, impression, postage, postage stamp, tender, legal tender, revenue stamp, pestle, seal, stomp, stump, pigeonhole, stereotype, emboss, boss"
child,"child, kid, youngster, minor, shaver, nipper, small fry, tiddler, tike, tyke, fry, nestling, baby"
district,"district, territory, territorial dominion, dominion, zone"
edge,"edge, border, boundary, bound, sharpness, inch, adjoin, abut, march, butt, butt against, butt on"
squeeze,"squeeze, squeezing, credit crunch, liquidity crisis, wring, power play, squeeze play, hug, clinch, squash, crush, squelch, mash, wedge, force, coerce, hale, pressure, extort, rack, gouge, thrust, stuff, shove, pinch, twinge, tweet, nip, twitch, embrace, bosom, compress, constrict, compact, contract, press"
christian,"Christian, christian"
paperwork,paperwork
spinning,"spinning, spin, spin around, whirl, reel, gyrate, birl, twirl, spin out"
heap,"pile, heap, mound, agglomerate, cumulation, cumulus, batch, deal, flock, good deal, great deal, hatful, lot, mass, mess, mickle, mint, mountain, muckle, passel, peck, plenty, pot, quite a little, raft, sight, slew, spate, stack, tidy sum, wad, bus, jalopy"
dinning,"boom, din"
cradled,cradle
parlor,"parlor, parlour, living room, living-room, sitting room, front room"
fit,"fit, tantrum, scene, conniption, paroxysm, convulsion, burst, suit, accommodate, go, meet, conform to, match, correspond, check, jibe, gibe, tally, agree, equip, fit out, outfit, primed, set"
employees,employee
courts,"court, tribunal, judicature, courtroom, royal court, Court, Margaret Court, motor hotel, motor inn, motor lodge, tourist court, lawcourt, court of law, court of justice, courtyard, homage, woo, romance, solicit"
filing,"filing, file, register, charge, lodge, file away"
applications,"application, practical application, coating, covering, application program, applications programme, lotion, diligence"
membership,"membership, rank"
bills,"bill, measure, account, invoice, note, government note, bank bill, banker's bill, bank note, banknote, Federal Reserve note, greenback, circular, handbill, broadside, broadsheet, flier, flyer, throwaway, poster, posting, placard, notice, card, billhook, peak, eyeshade, visor, vizor, beak, neb, nib, pecker, charge"
hundredth,"hundredth, one-hundredth, one percent, centesimal, 100th"
routine,"routine, modus operandi, act, number, turn, bit, subroutine, subprogram, procedure, function, everyday, mundane, quotidian, unremarkable, workaday"
blocks,"block, city block, cube, mental block, pulley, pulley-block, pulley block, engine block, cylinder block, blockage, closure, occlusion, stop, stoppage, auction block, blocking, barricade, blockade, block off, block up, bar, obstruct, hinder, stymie, stymy, embarrass, halt, kibosh, jam, stuff, lug, choke up, obturate, impede, occlude, close up, parry, deflect, forget, blank out, draw a blank, freeze, immobilize, immobilise"
addressed,"address, turn to, speak, direct, call, cover, treat, handle, plow, deal, accost, come up to, addressed"
’cause,
ripping,"rend, rip, rive, pull, rending, ripping, splitting"
gets,"get, acquire, become, go, let, have, receive, find, obtain, incur, arrive, come, bring, convey, fetch, experience, pay back, pay off, fix, make, induce, stimulate, cause, catch, capture, grow, develop, produce, contract, take, drive, aim, arrest, scram, buzz off, fuck off, bugger off, get under one's skin, draw, perplex, vex, stick, puzzle, mystify, baffle, beat, pose, bewilder, flummox, stupefy, nonplus, gravel, amaze, dumbfound, get down, begin, start out, start, set about, set out, commence, suffer, sustain, beget, engender, father, mother, sire, generate, bring forth"
envelopes,"envelope, gasbag, envelop, enfold, enwrap, wrap, enclose"
putting,"putt, putting, put, set, place, pose, position, lay, frame, redact, cast, couch, assign, invest, commit, arrange, set up, order"
envelope,"envelope, gasbag"
duties,"duty, responsibility, obligation, tariff"
finds,"discovery, breakthrough, find, uncovering, happen, chance, bump, encounter, detect, observe, discover, notice, regain, determine, find out, ascertain, feel, witness, see, line up, get hold, come up, rule, receive, get, obtain, incur, recover, retrieve, find oneself"
hummed,"hum, buzz, seethe, thrum"
softly,"softly, quietly, lightly, gently, piano"
worked,"work, do work, act, function, operate, go, run, work on, process, exercise, work out, make, bring, play, wreak, make for, put to work, cultivate, crop, influence, act upon, shape, form, mold, mould, forge, knead, exploit, solve, figure out, puzzle out, lick, ferment, sour, turn"
silently,"mutely, wordlessly, silently, taciturnly"
cookies,"cookie, cooky, biscuit"
opinion,"opinion, sentiment, persuasion, view, thought, public opinion, popular opinion, vox populi, legal opinion, judgment, judgement, ruling, impression, feeling, belief, notion"
trust,"trust, reliance, trustingness, trustfulness, corporate trust, combine, cartel, faith, confidence, swear, rely, bank, believe, hope, desire, entrust, intrust, confide, commit"
worst,"worst, pip, mop up, whip, rack up, bad, big, tough, spoiled, spoilt, regretful, sorry, uncollectible, risky, high-risk, speculative, unfit, unsound, forged, defective"
lesson,"lesson, example, deterrent example, object lesson, moral"
plans,"plan, program, programme, design, architectural plan, be after, project, contrive"
complimented,"compliment, congratulate"
washing,"wash, washing, lavation, laundry, washables, rinse, lave, launder, wash out, wash off, wash away, moisten, dampen, lap"
twelfth,"twelfth, one-twelfth, twelfth part, duodecimal, 12th"
counter,"counter, tabulator, buffet, sideboard, rejoinder, retort, return, riposte, replication, comeback, heel counter, counterpunch, parry, anticipate, foresee, forestall, antagonistic"
spatula,spatula
tall,"tall, grandiloquent, magniloquent, improbable, marvelous, marvellous"
oven,oven
opportunity,"opportunity, chance"
eating,"eating, feeding, eat, feed, eat on, consume, eat up, use up, deplete, exhaust, run through, wipe out, corrode, rust"
till,"till, boulder clay, public treasury, trough, cashbox, money box"
milk,"milk, Milk, Milk River"
batch,"batch, deal, flock, good deal, great deal, hatful, heap, lot, mass, mess, mickle, mint, mountain, muckle, passel, peck, pile, plenty, pot, quite a little, raft, sight, slew, spate, stack, tidy sum, wad, clutch"
convince,"convert, win over, convince"
hopefully,hopefully
faint,"faint, swoon, syncope, deliquium, conk, pass out, weak, dim, shadowy, vague, wispy, feeble, light, swooning, light-headed, lightheaded, fainthearted, timid, faint-hearted"
sets,"set, exercise set, stage set, circle, band, lot, bent, hardening, solidifying, solidification, curing, Set, Seth, readiness, put, place, pose, position, lay, determine, specify, define, fix, limit, mark, prepare, set up, ready, gear up, localize, localise, go down, go under, arrange, plant, jell, congeal, typeset, countersink, sic, rig, lay out, adjust, correct, fructify, dress, do, coif, coiffe, coiffure"
goodness,"good, goodness"
fifteenth,"fifteenth, 15th"
follow,"follow, postdate, fall out, travel along, comply, abide by, come after, conform to, adopt, espouse, take after, trace, watch, observe, watch over, keep an eye on, succeed, play along, accompany, keep up, keep abreast, come, be, surveil, survey, pursue, stick to, stick with"
plan,"plan, program, programme, design, architectural plan, be after, project, contrive"
sentences,"sentence, conviction, judgment of conviction, condemnation, prison term, time, condemn, doom"
disagree,"disagree, differ, dissent, take issue, disaccord, discord"
agrees,"agree, hold, concur, concord, match, fit, correspond, check, jibe, gibe, tally, harmonize, harmonise, consort, accord, fit in"
followed,"follow, postdate, fall out, travel along, comply, abide by, come after, conform to, adopt, espouse, take after, trace, watch, observe, watch over, keep an eye on, succeed, play along, accompany, keep up, keep abreast, come, be, surveil, survey, pursue, stick to, stick with"
grader,grader
dynamite,dynamite
sticks,"stick, control stick, joystick, pin, peg, joint, marijuana cigarette, reefer, spliff, lodge, wedge, deposit, stay, stick around, stay put, adhere, hold fast, bond, bind, stick to, stand by, stick by, cling, cleave, cohere, sting, perplex, vex, get, puzzle, mystify, baffle, beat, pose, bewilder, flummox, stupefy, nonplus, gravel, amaze, dumbfound"
squirrel,squirrel
intently,intently
rummaged,rummage
rodents,"rodent, gnawer"
luck,"fortune, destiny, fate, luck, lot, circumstances, portion, chance, hazard"
moly,
holy,"holy place, sanctum, holy"
recognize,"acknowledge, recognize, recognise, know, realize, realise, agnize, agnise, spot, distinguish, discern, pick out, make out, tell apart, accredit, greet"
halfway,"center, halfway, middle, midway"
arms,"weaponry, arms, implements of war, weapons system, munition, coat of arms, blazon, blazonry, arm, branch, limb, weapon, weapon system, subdivision, sleeve, build up, fortify, gird"
crossed,"traverse, track, cover, cross, pass over, get over, get across, cut through, cut across, intersect, thwart, queer, spoil, scotch, foil, frustrate, baffle, bilk, span, sweep, crossbreed, hybridize, hybridise, interbreed, crossed"
frown,"frown, scowl, glower, lour, lower"
shower,"shower, shower bath, rain shower, cascade, exhibitor, exhibitioner, lavish, shower down"
catch,"catch, gimmick, haul, match, stop, grab, snatch, snap, apprehension, arrest, collar, pinch, taking into custody, pick up, get, take hold of, capture, hitch, overtake, catch up with, take in, overhear, watch, view, see, trip up, enamour, trance, becharm, enamor, captivate, beguile, charm, fascinate, bewitch, entrance, enchant"
longer,"longer, thirster, yearner, long, retentive, recollective, tenacious, farseeing, farsighted, foresighted, foresightful, prospicient, longsighted"
warn,"warn, discourage, admonish, monish"
goes,"go, spell, tour, turn, Adam, ecstasy, XTC, disco biscuit, cristal, X, hug drug, crack, fling, pass, whirl, offer, go game, travel, move, locomote, proceed, go away, depart, become, get, run, lead, extend, sound, function, work, operate, run low, run short, survive, last, live, live on, endure, hold up, hold out, die, decease, perish, exit, pass away, expire, kick the bucket, cash in one's chips, buy the farm, conk, give-up the ghost, drop dead, pop off, choke, croak, snuff it, belong, start, get going, blend, blend in, fit, rifle, plump, fail, go bad, give way, give out, conk out, break, break down"
pitcher,"pitcher, hurler, twirler, ewer, pitcherful, mound"
renewed,"regenerate, renew, reincarnate, renewed"
drank,"drink, imbibe, booze, fuddle, toast, pledge, salute, wassail, drink in, tope"
stressful,"nerve-racking, nerve-wracking, stressful, trying"
fired,"open fire, fire, discharge, displace, give notice, can, dismiss, give the axe, send away, sack, force out, give the sack, terminate, go off, arouse, elicit, enkindle, kindle, evoke, raise, provoke, burn, burn down, fuel, discharged, dismissed, fired, laid-off, pink-slipped"
principals,"principal, school principal, head teacher, head, star, lead, corpus, principal sum, dealer"
secretaries,"secretary, secretarial assistant, repository, writing table, escritoire, secretaire"
tow,"tow, towage"
returned,"return, render, revert, retrovert, regress, turn back, hark back, come back, recall, take back, bring back, retort, repay, riposte, rejoin, refund, give back, deliver, reelect, fall, pass, devolve, yield, give, generate"
firing,"fire, firing, discharge, firing off, ignition, lighting, kindling, inflammation, dismissal, dismission, liberation, release, sack, sacking, open fire, displace, give notice, can, dismiss, give the axe, send away, force out, give the sack, terminate, go off, arouse, elicit, enkindle, kindle, evoke, raise, provoke, burn, burn down, fuel"
declared,"declare, announce, adjudge, hold, declared, stated"
quorum,quorum
discuss,"discus, saucer, discourse, talk about, discuss, hash out, talk over"
firings,"fire, firing, discharge, firing off, ignition, lighting, kindling, inflammation, dismissal, dismission, liberation, release, sack, sacking, open fire, displace, give notice, can, dismiss, give the axe, send away, force out, give the sack, terminate, go off, arouse, elicit, enkindle, kindle, evoke, raise, provoke, burn, burn down, fuel"
ate,"Ate, eat, feed, eat on, consume, eat up, use up, deplete, exhaust, run through, wipe out, corrode, rust"
supportive,supportive
fire,"fire, firing, flame, flaming, ardor, ardour, fervor, fervour, fervency, fervidness, attack, flak, flack, blast, open fire, discharge, displace, give notice, can, dismiss, give the axe, send away, sack, force out, give the sack, terminate, go off, arouse, elicit, enkindle, kindle, evoke, raise, provoke, burn, burn down, fuel"
president,"president, President of the United States, United States President, President, Chief Executive, chairman, chairwoman, chair, chairperson, prexy"
including,"include, admit, let in"
fault,"mistake, error, fault, defect, flaw, demerit, faulting, geological fault, shift, fracture, break, blame"
targeting,"target, aim, place, direct, point"
threats,"menace, threat, terror, scourge"
