Word,Synonyms
notice,"notice, observation, observance, notification, poster, posting, placard, bill, card, detect, observe, find, discover, mark, note, comment, remark, point out, acknowledge"
fear,"fear, fearfulness, fright, concern, care, reverence, awe, veneration, dread, revere, venerate"
pulling,"pull, pulling, draw, force, attract, pull in, draw in, perpetrate, commit, pull out, get out, take out, overstretch, rend, rip, rive, pluck, tear, deplume, deplumate, displume, extract, pull up, draw out, root for"
troubled,"disturb, upset, trouble, put out, inconvenience, disoblige, discommode, incommode, bother, perturb, unhinge, disquiet, cark, distract, disorder, trouble oneself, inconvenience oneself, ail, pain, troubled, disruptive, riotous, tumultuous, turbulent"
play,"play, drama, dramatic play, maneuver, manoeuvre, bid, child's play, playing period, period of play, free rein, shimmer, fun, sport, looseness, frolic, romp, gambol, caper, turn, gambling, gaming, swordplay, act, represent, spiel, act as, recreate, toy, run, fiddle, diddle, dally, trifle, flirt, roleplay, playact, bring, work, wreak, make for, bet, wager, meet, encounter, take on"
sodas,"sodium carbonate, washing soda, sal soda, soda ash, soda, pop, soda pop, soda water, tonic"
allowed,"let, allow, permit, countenance, grant, appropriate, earmark, set aside, reserve, leave, allow for, provide, take into account, admit, give up, tolerate"
son,"son, boy, Son, Word, Logos"
invite,"invite, ask for, ask over, ask round, tempt, bid, pay for, ask in, call for, receive, take in"
protested,"protest, resist, dissent"
brave,"brave, weather, endure, brave out, courageous, audacious, dauntless, fearless, hardy, intrepid, unfearing, braw, gay"
concentrated,"concentrate, focus, center, centre, pore, rivet, centralize, centralise, digest, condense, contract, boil down, reduce, decoct, concentrated, hard, saturated"
bellowed,"bawl, bellow, roar"
arrived,"arrive, get, come, make it, get in, go far"
curb,"curb, curbing, kerb, curb bit, American Stock Exchange, AMEX, Curb, bridle, check, control, hold in, hold, contain, moderate, suppress, stamp down, inhibit, subdue, conquer, restrict, curtail, cut back"
nerve,"nerve, nervus, heart, mettle, spunk, boldness, brass, face, cheek, steel"
aisle,"aisle, gangway"
single,"single, bingle, one, 1, I, ace, unity, individual, unmarried, undivided, exclusive"
carrying,"transport, carry, pack, take, impart, conduct, transmit, convey, channel, express, hold, bear, contain, extend, behave, acquit, deport, comport, stock, stockpile, run, dribble, persuade, sway, post, have a bun in the oven, gestate, expect"
seat,"seat, place, buttocks, nates, arse, butt, backside, bum, buns, can, fundament, hindquarters, hind end, keister, posterior, prat, rear, rear end, rump, stern, tail, tail end, tooshie, tush, bottom, behind, derriere, fanny, ass, sit, sit down, induct, invest"
narrow,"narrow, contract, pin down, peg down, nail down, narrow down, specify, specialize, specialise, constrict, constringe, narrow-minded, minute"
having,"have, have got, hold, feature, experience, receive, get, own, possess, let, consume, ingest, take in, take, throw, make, give, induce, stimulate, cause, accept, suffer, sustain, give birth, deliver, bear, birth"
killed,"kill, shoot down, defeat, vote down, vote out, stamp out, toss off, pop, bolt down, belt down, pour down, down, drink down, obliterate, wipe out"
wish,"wish, wishing, want, indirect request, regard, compliments, care, like, wish well, bid"
solve,"solve, work out, figure out, puzzle out, lick, work, resolve, clear"
strength,"strength, military capability, military strength, military posture, posture, force, forcefulness, forte, strong suit, long suit, metier, specialty, speciality, strong point, persuasiveness, intensity, intensity level, potency, effectiveness, lastingness, durability, enduringness"
worse,"worse, worsened, bad, big, tough, spoiled, spoilt, regretful, sorry, uncollectible, risky, high-risk, speculative, unfit, unsound, forged, defective"
clearing,"clearing, glade, clarification, unclutter, clear, clear up, light up, brighten, authorize, authorise, pass, top, shed light on, crystallize, crystallise, crystalize, crystalise, straighten out, sort out, enlighten, illuminate, elucidate, net, sack, sack up, gain, take in, make, earn, realize, realise, pull in, bring in, acquit, assoil, discharge, exonerate, exculpate, solve"
possible,"possible, potential"
books,"book, volume, record, record book, script, playscript, ledger, leger, account book, book of account, rule book, Koran, Quran, al-Qur'an, Book, Bible, Christian Bible, Good Book, Holy Scripture, Holy Writ, Scripture, Word of God, Word, reserve, hold"
skipped,"jump, pass over, skip, skip over, cut, hop, hop-skip, decamp, vamoose, bound off, skim, skitter"
added,"add, append, supply, lend, impart, bestow, contribute, bring, add together, total, tot, tot up, sum, sum up, summate, tote up, tally, add up"
wandering,"wandering, roving, vagabondage, roll, wander, swan, stray, tramp, roam, cast, ramble, rove, range, drift, vagabond, cheat on, cheat, cuckold, betray, weave, wind, thread, meander, digress, divagate, mobile, nomadic, peregrine, meandering, rambling, winding, erratic, planetary"
woods,"forest, wood, woods, Wood, Natalie Wood, Sir Henry Wood, Sir Henry Joseph Wood, Mrs. Henry Wood, Ellen Price Wood, Grant Wood, woodwind, woodwind instrument"
fool,"fool, sap, saphead, muggins, tomfool, chump, gull, mark, patsy, fall guy, sucker, soft touch, mug, jester, motley fool, befool, fritter, frivol away, dissipate, shoot, fritter away, fool away, dupe, slang, cod, put on, take in, put one over, put one across, horse around, arse around, fool around"
happen,"happen, hap, go on, pass off, occur, pass, fall out, come about, take place, befall, bechance, materialize, materialise, find, chance, bump, encounter"
apple,"apple, orchard apple tree, Malus pumila"
cue,"cue, clue, clew, discriminative stimulus, cue stick, pool cue, pool stick, prompt, remind"
managed,"pull off, negociate, bring off, carry off, manage, deal, care, handle, cope, get by, make out, make do, contend, grapple, oversee, supervise, superintend, wangle, finagle, do, wield"
chatting,"chew the fat, shoot the breeze, chat, confabulate, confab, chitchat, chit-chat, chatter, chaffer, natter, gossip, jaw, claver, visit"
ignore,"ignore, disregard, snub, cut, dismiss, brush aside, brush off, discount, push aside, neglect"
sweat,"perspiration, sweat, sudor, fret, stew, lather, swither, effort, elbow grease, exertion, travail, sudate, perspire"
naughty,"blue, gamy, gamey, juicy, naughty, racy, risque, spicy"
bandaged,"bind, bandage, bandaged, bound"
knowing,"knowing, know, cognize, cognise, experience, live, acknowledge, recognize, recognise, sleep together, roll in the hay, love, make out, make love, sleep with, get laid, have sex, do it, be intimate, have intercourse, have it away, have it off, screw, fuck, jazz, eff, hump, lie with, bed, have a go at it, bang, get it on, bonk, wise, wise to, intentional, knowledgeable, learned, lettered, well-educated, well-read"
stepping,"step, tread, mistreat, maltreat, abuse, ill-use, ill-treat, pace"
howdy,"hello, hullo, hi, howdy, how-do-you-do"
p.m.,"post meridiem, p.m., P.M."
carry,"carry, transport, pack, take, impart, conduct, transmit, convey, channel, express, hold, bear, contain, extend, behave, acquit, deport, comport, stock, stockpile, run, dribble, persuade, sway, post, have a bun in the oven, gestate, expect"
cowpoke,"cowboy, cowpuncher, puncher, cowman, cattleman, cowpoke, cowhand, cowherd"
cokes,"coke, Coca Cola, Coke, blow, nose candy, snow, C"
dogs,"dog, domestic dog, Canis familiaris, frump, cad, bounder, blackguard, hound, heel, frank, frankfurter, hotdog, hot dog, wiener, wienerwurst, weenie, pawl, detent, click, andiron, firedog, dog-iron, chase, chase after, trail, tail, tag, give chase, go after, track"
stop,"stop, halt, stoppage, stopover, layover, arrest, check, hitch, stay, stop consonant, occlusive, plosive consonant, plosive speech sound, plosive, period, point, full stop, full point, diaphragm, catch, blockage, block, closure, occlusion, discontinue, cease, give up, quit, lay off, kibosh, stop over, break, break off, turn back, contain, hold back, intercept, end, finish, terminate, barricade, blockade, block off, block up, bar, hold on"
cowboy,"cowboy, cowpuncher, puncher, cowman, cattleman, cowpoke, cowhand, cowherd, rodeo rider"
frozen,"freeze, stop dead, suspend, freeze out, freeze down, block, immobilize, immobilise, frozen, rooted, stock-still, frigid, frosty, glacial, icy, wintry, flash-frozen, quick-frozen, fixed"
hanging,"hanging, wall hanging, suspension, dangling, hang, hang up, string up, fall, flow, attend, advert, pay heed, give ear, cling"
shove,"shove, jostle, thrust, stuff, squeeze"
darkness,"dark, darkness, shadow, iniquity, wickedness, duskiness, swarthiness"
meeting,"meeting, group meeting, get together, encounter, coming together, merging, confluence, meet, run into, run across, come across, see, converge, satisfy, fill, fulfill, fulfil, fit, conform to, match, cope with, gather, assemble, forgather, foregather, play, take on, receive, suffer, touch, adjoin, contact"
lessons,"lesson, example, deterrent example, object lesson, moral"
years,"old age, years, age, eld, geezerhood, long time, days, year, twelvemonth, yr, class"
loomed,"loom, tower, predominate, hulk, brood, hover, bulk large"
gives,"give, spring, springiness, yield, afford, pay, hold, throw, have, make, gift, present, devote, render, return, generate, impart, leave, pass on, establish, sacrifice, pass, hand, reach, turn over, dedicate, consecrate, commit, apply, grant, move over, give way, ease up, feed, contribute, chip in, kick in, collapse, fall in, cave in, break, founder, open"
lady,"lady, dame, madam, ma'am, gentlewoman, Lady, noblewoman, peeress"
factory,"factory, mill, manufacturing plant, manufactory"
owns,"own, have, possess"
tree,"tree, tree diagram, Tree, Sir Herbert Beerbohm Tree, corner, shoetree"
mane,"mane, head of hair"
squabbling,"quibble, niggle, pettifog, bicker, squabble, brabble"
shoe,"shoe, horseshoe, brake shoe, skid"
carton,"carton, cartonful"
leaked,"leak, leak out"
yolk,"egg yolk, yolk, vitellus"
recognized,"acknowledge, recognize, recognise, know, realize, realise, agnize, agnise, spot, distinguish, discern, pick out, make out, tell apart, accredit, greet, accepted, recognized, recognised"
streetlights,"streetlight, street lamp"
trick,"trick, fast one, antic, joke, prank, caper, put-on, magic trick, conjuring trick, magic, legerdemain, conjuration, thaumaturgy, illusion, deception, whoremaster, whoremonger, john, flim-flam, play a joke on, play tricks, fob, fox, pull a fast one on, play a trick on"
treating,"treat, handle, do by, process, care for, cover, plow, deal, address, regale"
teach,"Teach, Edward Teach, Thatch, Edward Thatch, Blackbeard, teach, learn, instruct"
watched,"watch, observe, follow, watch over, keep an eye on, view, see, catch, take in, look on, look out, watch out, determine, check, find out, ascertain, learn"
egg,"egg, eggs, testis, testicle, orchis, ball, ballock, bollock, nut"
sew,"sew, run up, sew together, stitch, tailor, tailor-make"
electric,"electric, electric automobile, electric car, electrical, galvanic, galvanizing, galvanising"
boring,"drilling, boring, oil production, bore, tire, drill, deadening, dull, ho-hum, irksome, slow, tedious, tiresome, wearisome"
nod,nod
throwing,"throw, shed, cast, cast off, shake off, throw off, throw away, drop, thrust, give, flip, switch, project, contrive, bewilder, bemuse, discombobulate, hurl, hold, have, make, confuse, fox, befuddle, fuddle, bedevil, confound"
block,"block, city block, cube, mental block, pulley, pulley-block, pulley block, engine block, cylinder block, blockage, closure, occlusion, stop, stoppage, auction block, blocking, barricade, blockade, block off, block up, bar, obstruct, hinder, stymie, stymy, embarrass, halt, kibosh, jam, stuff, lug, choke up, obturate, impede, occlude, close up, parry, deflect, forget, blank out, draw a blank, freeze, immobilize, immobilise"
confessed,"confess, squeal, fink, concede, profess"
sheet,"sheet, piece of paper, sheet of paper, bed sheet, plane, tabloid, rag, flat solid, tack, mainsheet, weather sheet, shroud, sail, canvas, canvass"
scared,"frighten, fright, scare, affright, daunt, dash, scare off, pall, frighten off, scare away, frighten away, scar, mark, pock, pit, frightened, scared"
gestured,"gesticulate, gesture, motion"
fourteen,"fourteen, 14, XIV, xiv"
bridge,"bridge, span, bridge circuit, bridgework, nosepiece, bridge deck, bridge over"
played,"play, act, represent, spiel, act as, recreate, toy, run, fiddle, diddle, dally, trifle, flirt, roleplay, playact, bring, work, wreak, make for, bet, wager, meet, encounter, take on, played"
conversations,conversation
integrated,"integrate, incorporate, desegregate, mix, incorporated, integrated, merged, unified, structured"
joined,"join, fall in, get together, bring together, conjoin, connect, link, link up, unite, joined, united, coupled, linked"
repay,"refund, return, repay, give back, requite, reward, pay back, retort, come back, riposte, rejoin"
sliced,"slit, slice, slice up, chopped, shredded, sliced"
overall,"overall, boilersuit, boilers suit"
bread,"bread, breadstuff, staff of life, boodle, cabbage, clams, dinero, dough, gelt, kale, lettuce, lolly, lucre, loot, moolah, pelf, scratch, shekels, simoleons, sugar, wampum"
fairly,"reasonably, moderately, pretty, jolly, somewhat, fairly, middling, passably, fair, evenhandedly, clean"
flirting,"flirt, flirting, flirtation, coquetry, dalliance, toying, chat up, dally, butterfly, coquet, coquette, romance, philander, mash, toy, play"
early,"early, former, other, early on, ahead of time, too soon, betimes"
pork,"pork, porc, pork barrel"
sandwiches,sandwich
officials,"official, functionary"
council,council
active,"active agent, active, active voice, combat-ready, fighting, participating, alive, dynamic"
providing,"supply, provide, render, furnish, ply, cater, put up, offer, leave, allow for, allow, bring home the bacon"
legal,"legal, sound, effectual"
advice,advice
crumpled,"crumble, crumple, tumble, break down, collapse, buckle, pucker, rumple, cockle, knit, wrinkle, crease, crinkle, bent, crumpled, dented"
clothes,"apparel, wearing apparel, dress, clothes, clothe, enclothe, garb, raiment, tog, garment, habilitate, fit out, invest, adorn, cloak, drape, robe"
relatives,"relative, relation, congener, congenator, congeneric"
committee,"committee, commission, citizens committee"
arrested,"collar, nail, apprehend, arrest, pick up, nab, cop, check, turn back, stop, contain, hold back, catch, get, halt, hold"
town,"town, townspeople, townsfolk, township, Town, Ithiel Town"
visit,"visit, sojourn, see, travel to, call in, call, inspect, inflict, bring down, impose, chew the fat, shoot the breeze, chat, confabulate, confab, chitchat, chit-chat, chatter, chaffer, natter, gossip, jaw, claver"
exclaimed,"exclaim, cry, cry out, outcry, call out, shout, proclaim, promulgate"
mentioned,"mention, advert, bring up, cite, name, refer, note, observe, remark"
explain,"explain, explicate, excuse"
helped,"help, assist, aid, facilitate, help oneself, serve, avail"
glad,"gladiolus, gladiola, glad, sword lily, happy, beaming"
ninth,"ninth, one-ninth, 9th"
hung,"hang, hang up, string up, fall, flow, attend, advert, pay heed, give ear, cling"
fold,"fold, crease, plication, flexure, crimp, bend, congregation, faithful, folding, flock, plica, sheepfold, sheep pen, sheepcote, fold up, turn up, close up, close, shut down, close down, pen up"
dishes,"dish, dishful, smasher, stunner, knockout, beauty, ravisher, sweetheart, peach, lulu, looker, mantrap, dish aerial, dish antenna, saucer, cup of tea, bag, serve, serve up, dish out, dish up"
drained,"drain, run out, enfeeble, debilitate, drained, knackered, dead"
wiped,"wipe, pass over"
corner,"corner, nook, street corner, turning point, recess, recession, niche, box, quoin, tree"
injunctions,"injunction, enjoining, enjoinment, cease and desist order"
protestors,
fund,"fund, monetary fund, store, stock, investment company, investment trust, investment firm"
selfish,selfish
won,"South Korean won, won, North Korean won, win, acquire, gain, advance, pull ahead, make headway, get ahead, gain ground, succeed, come through, bring home the bacon, deliver the goods"
uncaring,"detached, unaffectionate, uncaring, thoughtless, unthinking"
rounds,"round, unit of ammunition, one shot, cycle, rhythm, beat, round of golf, daily round, turn, bout, round of drinks, troll, rung, stave, circle, round out, round off, labialize, labialise, attack, assail, lash out, snipe, assault, polish, polish up, brush up, round down, flesh out, fill out"
cartons,"carton, cartonful"
dealing,"dealing, transaction, dealings, cover, treat, handle, plow, deal, address, consider, take, look at, cope, get by, make out, make do, contend, grapple, manage, distribute, administer, mete out, parcel out, lot, dispense, shell out, deal out, dish out, allot, dole out, sell, trade, care, conduct, carry on, share, divvy up, portion out, apportion"
flew,"fly, wing, aviate, pilot, fell, vanish, flee, take flight, vaporize"
filed,"file, register, charge, lodge, file away"
hopeful,"aspirant, aspirer, hopeful, wannabe, wannabee, bright, promising"
process,"procedure, process, cognitive process, mental process, operation, cognitive operation, summons, unconscious process, outgrowth, appendage, physical process, treat, action, sue, litigate, march, work, work on, serve, swear out"
disrupt,"interrupt, disrupt, break up, cut off"
deck,"deck, pack of cards, deck of cards, adorn, decorate, grace, embellish, beautify, bedight, bedeck, coldcock, dump, knock down, floor"
eighteen,"eighteen, 18, XVIII, xviii"
notebook,"notebook, notebook computer"
pink,"pink, garden pink, pinko, tap, rap, knock, ping, pinkish"
pinkie,"little finger, pinkie, pinky"
ending,"ending, termination, conclusion, end, finish, close, closing, stop, terminate, cease"
listening,"listening, hearing, listen, hear, take heed, heed, mind"
bars,"parallel bars, bars, barroom, bar, saloon, ginmill, taproom, measure, prevention, legal profession, legal community, stripe, streak, cake, Browning automatic rifle, BAR, debar, exclude, barricade, block, blockade, stop, block off, block up, banish, relegate"
stationery,"stationery, letter paper"
count,"count, counting, numeration, enumeration, reckoning, tally, number, enumerate, numerate, matter, weigh, consider, bet, depend, look, calculate, reckon"
fingers,"finger, fingerbreadth, finger's breadth, digit, thumb, feel"
notes,"note, short letter, line, billet, musical note, tone, bill, government note, bank bill, banker's bill, bank note, banknote, Federal Reserve note, greenback, annotation, notation, eminence, distinction, preeminence, promissory note, note of hand, observe, mention, remark, notice, mark, take note, take down"
labeled,"label, tag, mark, pronounce, judge, labeled, labelled, tagged"
spent,"spend, pass, expend, drop, exhausted, spent, dog-tired, fagged, fatigued, played out, washed-out, worn-out, worn out"
x,"ten, 10, X, tenner, decade, x, ex, Adam, ecstasy, XTC, go, disco biscuit, cristal, hug drug"
y,"yttrium, Y, atomic number 39, y, wye"
finger,"finger, fingerbreadth, finger's breadth, digit, thumb, feel"
scream,"scream, screaming, shriek, shrieking, screech, screeching, belly laugh, sidesplitter, howler, thigh-slapper, wow, riot, shout, shout out, cry, call, yell, holler, hollo, squall"
cool,"cool, aplomb, assuredness, poise, sang-froid, chill, cool down, cool off, coolheaded, nerveless"
solving,"resolution, solving, solve, work out, figure out, puzzle out, lick, work, resolve, clear"
unknown,"unknown, unknown region, terra incognita, stranger, alien, unknown quantity, nameless, unidentified, unnamed, obscure, unsung, strange"
discussion,"discussion, treatment, discourse, give-and-take, word"
refreshments,"refreshment, recreation"
adjourned,"adjourn, recess, break up, withdraw, retire"
fascinating,"intrigue, fascinate, transfix, grip, spellbind, capture, enamour, trance, catch, becharm, enamor, captivate, beguile, charm, bewitch, entrance, enchant, absorbing, engrossing, fascinating, gripping, riveting, bewitching, captivating, enchanting, enthralling, entrancing"
odd,"odd, uneven, curious, funny, peculiar, queer, rum, rummy, singular, unmatched, unmated, unpaired, leftover, left over, left, remaining, unexpended"
permission,"permission, license, permit"
arranged,"arrange, set up, fix up, stage, format, dress, set, do, coif, coiffe, coiffure, put, order, arranged, ordered, staged"
sole,"sole, fillet of sole, resole, exclusive, lone, lonesome, only, solitary"
aim,"purpose, intent, intention, aim, design, object, objective, target, bearing, heading, take, train, take aim, direct, purport, propose, drive, get, calculate, place, point, draw a bead on, aspire, shoot for"
reopened,reopen
integrationist,
calls,"call, phone call, telephone call, Call, cry, outcry, yell, shout, vociferation, claim, birdcall, birdsong, song, margin call, call option, name, telephone, call up, phone, ring, shout out, scream, holler, hollo, squall, send for, visit, call in, address, bid, call off, predict, foretell, prognosticate, forebode, anticipate, promise"
sign,"sign, mark, signal, signaling, signboard, sign of the zodiac, star sign, mansion, house, planetary house, polarity, augury, foretoken, preindication, subscribe, ratify, contract, sign on, sign up, signalize, signalise, bless, gestural, signed, sign-language"
petition,"request, petition, postulation, prayer, orison"
founders,"laminitis, founder, beginner, founding father, father, fall through, fall flat, flop, collapse, fall in, cave in, give, give way, break"
frustrating,"thwart, queer, spoil, scotch, foil, cross, frustrate, baffle, bilk, torment, rag, bedevil, crucify, dun, frustrating, frustrative, thwarting"
chair,"chair, professorship, president, chairman, chairwoman, chairperson, electric chair, death chair, hot seat, moderate, lead"
grabbed,"catch, grab, take hold of, snap up, snaffle, seize"
stands,"base, pedestal, stand, rack, standstill, tie-up, point of view, viewpoint, standpoint, stall, sales booth, bandstand, outdoor stage, stand up, remain firm, digest, endure, stick out, stomach, bear, tolerate, support, brook, abide, suffer, put up, place upright, resist, fend"
candidates,"campaigner, candidate, nominee, prospect"
situation,"situation, state of affairs, position, site, post, berth, office, spot, billet, place"
frustration,"frustration, defeat, thwarting, foiling"
resigned,"vacate, resign, renounce, give up, leave office, quit, step down, release, relinquish, free, reconcile, submit"
leaders,"leadership, leaders, leader, drawing card, loss leader"
grab,"grab, catch, snatch, snap, take hold of, snap up, snaffle, seize"
cucumber,"cucumber, cucumber vine, Cucumis sativus, cuke"
intention,"purpose, intent, intention, aim, design"
animal,"animal, animate being, beast, brute, creature, fauna, carnal, fleshly, sensual"
ark,"Ark, Ark of the Covenant, ark"
end,"end, terminal, ending, last, final stage, goal, destruction, death, conclusion, close, closing, remainder, remnant, oddment, stop, finish, terminate, cease"
idealism,"idealism, high-mindedness, noble-mindedness"
appreciate,"appreciate, take account, prize, value, treasure, apprize, apprise, revalue"
admitting,"admit, acknowledge, allow in, let in, intromit, include, accept, take, take on, allow, accommodate, hold"
bit,"spot, bit, chip, flake, fleck, scrap, moment, mo, minute, second, piece, morsel, bite, snatch, act, routine, number, turn, seize with teeth, sting, burn, prick"
neat,"neat, orderly, refined, tasteful, clean, bang-up, bully, corking, cracking, dandy, great, groovy, keen, nifty, not bad, peachy, slap-up, swell, smashing, straight, full-strength"
chairs,"chair, professorship, president, chairman, chairwoman, chairperson, electric chair, death chair, hot seat, moderate, lead"
folding,"protein folding, folding, fold, fold up, turn up, close up, close, shut down, close down, pen up, foldable, foldaway"
fancy,"illusion, fantasy, phantasy, fancy, fondness, partiality, visualize, visualise, envision, project, see, figure, picture, image, go for, take to"
flowers,"flower, bloom, blossom, prime, peak, heyday, efflorescence, flush"
clenched,"clench, clinch, clenched, clinched"
tailored,"tailor, orient, cut, sew, tailor-make, tailored, trim, bespoke, bespoken, made-to-order, tailor-made"
pearls,"pearl, bone, ivory, off-white, drop, bead"
hours,"hours, hour, hr, 60 minutes, time of day, minute"
public,"populace, public, world"
watch—“just,
leaves,"leaf, leafage, foliage, folio, leave, leave of absence, farewell, leave-taking, parting, go forth, go away, leave alone, leave behind, exit, go out, get out, allow for, allow, provide, result, lead, depart, pull up stakes, entrust, bequeath, will, impart, give, pass on, forget"
business,"business, concern, business concern, business organization, business organisation, commercial enterprise, business enterprise, occupation, job, line of work, line, business sector, clientele, patronage, stage business, byplay"
us”—she,
wander,"roll, wander, swan, stray, tramp, roam, cast, ramble, rove, range, drift, vagabond, cheat on, cheat, cuckold, betray, weave, wind, thread, meander, digress, divagate"
tagged,"tag, label, mark, chase, chase after, trail, tail, give chase, dog, go after, track, labeled, labelled, tagged"
sense,"sense, signified, sensation, sentience, sentiency, sensory faculty, common sense, good sense, gumption, horse sense, mother wit, feel, smell, smell out"
terrance,
scar,"scar, cicatrix, cicatrice, scratch, scrape, mark, pock, pit"
